{
  "eventId": "22222222-2222-4222-8222-222222222222",
  "eventType": "TradeCanceled",
  "schemaVersion": 1,
  "occurredAt": "2026-07-24T03:01:00Z",
  "producer": "property-data",
  "aggregateType": "Trade",
  "aggregateId": "trade-501",
  "aggregateVersion": 18,
  "correlationId": "rtms-run-20260724",
  "causationId": "11111111-1111-4111-8111-111111111111",
  "traceId": "trace-222",
  "payload": {
    "tradeId": "trade-501",
    "complexId": 501,
    "canceledOn": "2026-07-24"
  }
}
